{
  "schema_version": "ai-experiments.semantic-ir.capability-execution-freeze/v2",
  "freeze_id": "semantic-ir-capability-calibration/heterogeneous-patches-v2",
  "status": "frozen_pre_execution",
  "purpose": "calibration",
  "initial_user_message": "Complete the task through the provided tools. Context artifacts use immutable context:// handles and repository files use workspace-relative paths. In the semantic arm, inspect selected state nodes to obtain opaque precondition tokens before submitting one patch. Recover from typed tool errors within the available budget and call submission_finish when final.",
  "claim_boundary": {
    "execution_variables_complete": true,
    "model_calls_authorized": false,
    "experimental_subject_calls_observed": 0,
    "efficacy_claim_authorized": false,
    "remaining_before_launch": [
      "explicit_launch"
    ]
  },
  "final_suite": {
    "path": "construction/capability-patch-tasks-v2/suite.json",
    "sha256": "f87df7fbb721f517a9a0ea74657c662ea6f2d0053fa1bbf569704625b1b0f014"
  },
  "model_sources": {
    "model_lock": {
      "path": "experiments/coding-agents/local-first-routing/2026-07-30/model-lock.json",
      "sha256": "b4147d513b82837a6a21b3f649cfe4ef3968f80c18ce69920dcbdeceafcaef31"
    },
    "hosted_access": {
      "path": "experiments/coding-agents/local-first-routing/2026-07-30/calibration/hosted-treatment.json",
      "sha256": "aba89d9cc41c24d31423ebd9199c080a7cbd641eabda25644ffe9b19468de413"
    }
  },
  "provider_access": {
    "api_base_url": "https://bedrock-runtime.us-east-1.amazonaws.com",
    "credential_source": "macos_keychain",
    "keychain_service": "aws-bedrock-fable5",
    "keychain_account": "968138089800",
    "credential_may_enter_model_context": false,
    "prior_treatment_admission_policy_reused": false
  },
  "model": {
    "provider": "Amazon Bedrock",
    "provider_model": "us.anthropic.claude-sonnet-4-6",
    "foundation_model": "anthropic.claude-sonnet-4-6",
    "api_format": "bedrock-converse",
    "region": "us-east-1",
    "experiment_context_length": 65536,
    "identity_policy": "endpoint_locked_model_and_iam_scope",
    "provider_substitution_allowed": false
  },
  "sampling": {
    "temperature": 0,
    "maximum_output_tokens_per_turn": 4096,
    "seed": null
  },
  "limits": {
    "model_turns_per_call_cell": 12,
    "tool_calls_per_turn": 4,
    "mutation_attempts_per_cell": 3,
    "public_evaluations_per_cell": 2,
    "hidden_evaluations_per_cell": 1,
    "provider_retries": 0,
    "inference_timeout_seconds": 300,
    "cell_timeout_seconds": 900,
    "maximum_provider_requests": 132,
    "maximum_total_spend_usd": 10.0
  },
  "accounting": {
    "source": "provider_native_usage",
    "include_all_trajectory_requests": true,
    "input_metric": "sum_usage_inputTokens",
    "cached_input_metric": "sum_usage_cacheReadInputTokens",
    "output_metric": "sum_usage_outputTokens",
    "terminal_payload_bytes": true,
    "input_usd_per_million_tokens": 3.0,
    "cached_input_usd_per_million_tokens": 0.3,
    "output_usd_per_million_tokens": 15.0
  },
  "isolation": {
    "subject_surface": "closed_tool_protocol",
    "workspace": "fresh_ephemeral_copy_per_cell",
    "host_repository_access": "denied_to_subject",
    "shell_access": "denied",
    "external_network_and_browsing": "denied_to_subject",
    "orchestrator_provider_egress": "bedrock_endpoint_only",
    "evaluator_network": "denied",
    "credential_source": "macos_keychain",
    "credentials_in_model_context": false,
    "hidden_evaluator_after_finish_only": true,
    "hidden_feedback_to_subject": false,
    "evidence_contains_provider_payloads": true,
    "evidence_publication_requires_secret_scan": true,
    "context_surface": "immutable_allowlisted_artifacts",
    "context_addressing": "context_uri_handles",
    "tool_error_policy": "typed_recoverable_results_within_turn_budget",
    "semantic_preconditions": "opaque_capability_tokens_resolved_inside_trusted_boundary"
  },
  "tasks": [
    {
      "candidate_task_id": "semantic-patch-suite/cross-module-rename-001",
      "instance_id": "semantic-ir-capability-v2/cross-module-rename-001",
      "slug": "cross-module-rename-001",
      "task_root": "tasks/cross-module-rename-001",
      "task_manifest_sha256": "fe0a1d734b9c3f3e2ebea0e8672775f0c0b43446959b0f035902e465f2a28c2c",
      "workspace_tree_sha256": "c7bc86bac45d93b5d5123233050ccbc61ea66875e225ff7980afd09986e4ecb4",
      "hidden_evaluator_sha256": "6cb7b7d9a74c8f2487e4a095f40e2547681c85c193cdb8bc6efd6ec6b30d7425",
      "final_semantic_disposition": "unsupported"
    },
    {
      "candidate_task_id": "semantic-patch-suite/directory-fallback-001",
      "instance_id": "semantic-ir-capability-v2/directory-fallback-001",
      "slug": "directory-fallback-001",
      "task_root": "tasks/directory-fallback-001",
      "task_manifest_sha256": "29e94cbea9a909efd08014d70f5cad77314571bfe0189543ac426e77470aa587",
      "workspace_tree_sha256": "2e54adbb94581cf92da6b48a7cc2af66b6ce814ffe77ba58b0665a76b3808fb0",
      "hidden_evaluator_sha256": "378e20abd66a8ede2f8827caba16f684c24056d3c5a75a9d64257a4ba834d885",
      "final_semantic_disposition": "supported"
    },
    {
      "candidate_task_id": "semantic-patch-suite/error-taxonomy-001",
      "instance_id": "semantic-ir-capability-v2/error-taxonomy-001",
      "slug": "error-taxonomy-001",
      "task_root": "tasks/error-taxonomy-001",
      "task_manifest_sha256": "69928d2ede388e6259aff23a9f7a2e8a30251ec8e8eb60539f6251e9da882d65",
      "workspace_tree_sha256": "500f5fd73c9c5fef75d75e4fd7b89b49f7b8e4246df6c8afb01465b7a3af0d0b",
      "hidden_evaluator_sha256": "8b112e77402ebdb19134574ffefe389328bc800581e380b1921bf770c4fbe77f",
      "final_semantic_disposition": "supported"
    },
    {
      "candidate_task_id": "semantic-patch-suite/normalization-policy-001",
      "instance_id": "semantic-ir-capability-v2/normalization-policy-001",
      "slug": "normalization-policy-001",
      "task_root": "tasks/normalization-policy-001",
      "task_manifest_sha256": "44a8f2ea2cebc1bd24e8aa9c1cad21fa5480e9d69741a078510e7e7c9ebc1209",
      "workspace_tree_sha256": "9f49d88602537b1df24fedff1bf98cf048e34402502e788304aa49b4fa570b48",
      "hidden_evaluator_sha256": "26c736064155293b1302d489f1b4c117f527698c1064a1cd519ef201f33d3c33",
      "final_semantic_disposition": "supported"
    },
    {
      "candidate_task_id": "semantic-patch-suite/raw-id-retry-001",
      "instance_id": "semantic-ir-capability-v2/raw-id-retry-001",
      "slug": "raw-id-retry-001",
      "task_root": "tasks/raw-id-retry-001",
      "task_manifest_sha256": "f3c891bc287f6663b9fd20a50e181ccab8ebef2580dc3a0735f4ae0f6163d040",
      "workspace_tree_sha256": "1db1bbbcb01a588b8edf925a96a7e8606ffa47f252650ae08be7dfe5151d2dd6",
      "hidden_evaluator_sha256": "88e58e17bcd36af530fe815973115e782e2ecbd323808ee3e16c1216ada05850",
      "final_semantic_disposition": "supported"
    },
    {
      "candidate_task_id": "semantic-patch-suite/reserved-id-guard-001",
      "instance_id": "semantic-ir-capability-v2/reserved-id-guard-001",
      "slug": "reserved-id-guard-001",
      "task_root": "tasks/reserved-id-guard-001",
      "task_manifest_sha256": "2030ae6a41e73f8228bd14cb7bb1b821045b5949e1f6b1a6b1fccb3b1c7f4da3",
      "workspace_tree_sha256": "b45d9b30df351307ef0a61de9b3c4c627828ec20ba114028e7a03103a12b9803",
      "hidden_evaluator_sha256": "cce67cb2453e98be5cf0976a7e73a597f0f907697d28527270ce37aa91f02fa9",
      "final_semantic_disposition": "supported"
    }
  ],
  "schedule": {
    "adaptive_ordering": false,
    "adaptive_stopping": false,
    "source_first_pairs": 3,
    "semantic_first_pairs": 3,
    "provider_call_cells": 11,
    "cells": [
      {
        "sequence": 1,
        "cell_id": "semantic-ir-capability-calibration/error-taxonomy-001/source",
        "candidate_task_id": "semantic-patch-suite/error-taxonomy-001",
        "task_root": "tasks/error-taxonomy-001",
        "arm": "source",
        "provider_call": true,
        "context": {
          "path": "contexts/01-error-taxonomy-001-source.txt",
          "bytes": 1317,
          "sha256": "3c359dae75b39bb5b5d2005a1e12e6599f7aef6f379e216d5adf5dd55b88a456",
          "ordered_sources": [
            "tasks/error-taxonomy-001/participant-context/TASK.md",
            "tasks/error-taxonomy-001/participant-context/source-patch.md"
          ],
          "manifest_path": "contexts/01-error-taxonomy-001-source.json",
          "manifest_sha256": "c32d1f608a4dfdbf0be825fb6aa50c981e2cecbe4259739394dd25cd8f6fb952"
        },
        "tools": {
          "path": "tools/01-error-taxonomy-001-source.json",
          "bytes": 2784,
          "sha256": "979b64856b6c19ff07636a1a7a07318ad5129196d16c059e1f5ab17edabd5766"
        },
        "terminal_policy": "agent_submission_finish"
      },
      {
        "sequence": 2,
        "cell_id": "semantic-ir-capability-calibration/error-taxonomy-001/semantic",
        "candidate_task_id": "semantic-patch-suite/error-taxonomy-001",
        "task_root": "tasks/error-taxonomy-001",
        "arm": "semantic",
        "provider_call": true,
        "context": {
          "path": "contexts/02-error-taxonomy-001-semantic.txt",
          "bytes": 15421,
          "sha256": "a6c9840173437c95821edeadbaba7b47cd843afb9f1baa374a01b685a6c9ccb2",
          "ordered_sources": [
            "tasks/error-taxonomy-001/participant-context/TASK.md",
            "tasks/error-taxonomy-001/participant-context/semantic-patch.md",
            "tasks/error-taxonomy-001/base/program.json",
            "tasks/error-taxonomy-001/participant-context/catalog.json",
            "tasks/error-taxonomy-001/participant-context/program-schema.json",
            "tasks/error-taxonomy-001/participant-context/semantic-patch-schema.json"
          ],
          "manifest_path": "contexts/02-error-taxonomy-001-semantic.json",